{
  "schema": "atlas-ml-scientific-review/v1",
  "experiment_ref": "tests/fixtures/scientific_review_cases.json#cases/holdout_reuse",
  "reviewer": "synthetic-independent-reviewer-example",
  "disposition": "FAIL",
  "checks": {"problem_target": "PASS", "point_in_time": "PASS", "leakage": "PASS", "holdout": "FAIL", "baseline": "PASS", "metrics": "PASS", "limitations": "PASS", "reproducibility": "BLOCKED", "interpretation": "PASS"},
  "evidence": ["tests/fixtures/scientific_review_cases.json#base", "config/examples/synthetic-lineage-v1.json", "tests/fixtures/scientific_review_cases.json#cases/holdout_reuse"],
  "findings": ["Final holdout was used for hyperparameter tuning.", "The existing lineage uses an illustrative git SHA. Fixture arithmetic is replayable, but a real experiment identity/evaluation is not established."],
  "remediation": "Stop selection; record contamination and obtain a reviewed fresh evaluation plan."
}
